FIRM_ID,ID,FIRST_NAME,OTHER_NAMES,SECOND_NAME,DISCLOSURE_DATE,DISCLOSURE_TYPE,DISCLOSURE_RESULT,DISCLOSURE_INFO,FINRA_EMPLOYMENT_DATES,FINRA_EMPLOYMENT
10205,1257873,DEWEY,[],SINK,1/23/1996,Employment Separation After Allegations,,"{
  ""Firm Name"" : ""LIFE INS. CO. OF VIRGINIA"",
  ""Termination Type"" : ""Permitted to Resign"",
  ""Allegations"" : ""PERMITTED TO RESIGN FROM LIFE INSURANCE CO. OF VIRGINIA PER  PER DRP INFO IN CRD""
}",12/7/2012 - Current,"SECURITIES AMERICA, INC. (10205)"
10205,1257873,DEWEY,[],SINK,,,,,1/2/2008 - 12/7/2012,"INVESTORS SECURITY COMPANY, INC. (2331)"
10205,1257873,DEWEY,[],SINK,,,,,9/8/2003 - 11/1/2006,"INVESTORS SECURITY COMPANY, INC. (2331)"
10205,1257873,DEWEY,[],SINK,,,,,9/12/2000 - 11/9/2001,"INVESTORS SECURITY COMPANY, INC. (2331)"
10205,1257873,DEWEY,[],SINK,,,,,3/13/1996 - 4/18/2000,"THE ADVISORS GROUP, INC. (14035)"
10205,1257873,DEWEY,[],SINK,,,,,9/7/1984 - 2/1/1996,"FORTH FINANCIAL SECURITIES, CORPORATION (14363)"
