FIRM_ID,ID,FIRST_NAME,OTHER_NAMES,SECOND_NAME,DISCLOSURE_DATE,DISCLOSURE_TYPE,DISCLOSURE_RESULT,DISCLOSURE_INFO,FINRA_EMPLOYMENT_DATES,FINRA_EMPLOYMENT
3978,1322147,CHARLES,[MIKE  GUTHREY],GUTHREY,4/13/2017,Employment Separation After Allegations,,"{
  ""Firm Name"" : ""Lincoln Financial Advisors"",
  ""Termination Type"" : ""Permitted to Resign"",
  ""Allegations"" : ""The representative was permitted to resign based on multiple policy violations including sending business direct prior to approval and not placing trades in a timely manner.""
}",3/17/2004 - 5/12/2017,LINCOLN FINANCIAL ADVISORS CORPORATION (3978)
3978,1322147,CHARLES,[MIKE  GUTHREY],GUTHREY,,,,,5/31/1996 - 5/12/2017,LINCOLN FINANCIAL ADVISORS CORPORATION (3978)
3978,1322147,CHARLES,[MIKE  GUTHREY],GUTHREY,,,,,5/31/1996 - 5/25/2006,THE LINCOLN NATIONAL LIFE INSURANCE COMPANY (2580)
3978,1322147,CHARLES,[MIKE  GUTHREY],GUTHREY,,,,,9/3/1985 - 5/15/1996,GUARDIAN INVESTOR SERVICES CORPORATION (6635)
