FIRM_ID,ID,FIRST_NAME,OTHER_NAMES,SECOND_NAME,DISCLOSURE_DATE,DISCLOSURE_TYPE,DISCLOSURE_RESULT,DISCLOSURE_INFO,FINRA_EMPLOYMENT_DATES,FINRA_EMPLOYMENT
2881,1352892,DAN,[DAN S TAYLOR],TAYLOR,,,,,9/26/1994 - 10/11/1995,"NORTHWESTERN MUTUAL INVESTMENT SERVICES, INC. (2881)"
2881,1352892,DAN,[DAN S TAYLOR],TAYLOR,,,,,9/23/1994 - 10/11/1995,ROBERT W. BAIRD & CO. INCORPORATED (8158)
2881,1352892,DAN,[DAN S TAYLOR],TAYLOR,,,,,4/8/1992 - 8/5/1994,GUARDIAN INVESTOR SERVICES CORPORATION (6635)
2881,1352892,DAN,[DAN S TAYLOR],TAYLOR,,,,,8/3/1989 - 12/5/1990,"SMA EQUITIES, INC. (3960)"
2881,1352892,DAN,[DAN S TAYLOR],TAYLOR,,,,,11/18/1985 - 8/14/1987,"NML EQUITY SERVICES, INC. (2881)"
2881,1352892,DAN,[DAN S TAYLOR],TAYLOR,,,,,4/30/1985 - 9/3/1985,THE EQUITABLE LIFE ASSURANCE SOCIETY OF THE UNITED STATES (4039)
