FIRM_ID,ID,FIRST_NAME,OTHER_NAMES,SECOND_NAME,DISCLOSURE_DATE,DISCLOSURE_TYPE,DISCLOSURE_RESULT,DISCLOSURE_INFO,FINRA_EMPLOYMENT_DATES,FINRA_EMPLOYMENT
114473,1541049,IRA,[],BARNETT,7/9/2001,Judgment / Lien,,"{
  ""Judgment/Lien Amount"" : ""$24,533.00"",
  ""Judgment/Lien Type"" : ""Tax""
}",3/14/2011 - 1/3/2012,"WORLD GROUP SECURITIES, INC. (114473)"
114473,1541049,IRA,[],BARNETT,,,,,8/9/2007 - 3/12/2009,INTERLINK SECURITIES CORP. (30505)
114473,1541049,IRA,[],BARNETT,,,,,4/7/2006 - 10/25/2006,PHOENIX EQUITY PLANNING CORPORATION (3036)
114473,1541049,IRA,[],BARNETT,,,,,3/23/2001 - 12/31/2001,THE O.N. EQUITY SALES COMPANY (2936)
114473,1541049,IRA,[],BARNETT,,,,,7/17/2000 - 3/16/2001,THE O.N. EQUITY SALES COMPANY (2936)
114473,1541049,IRA,[],BARNETT,,,,,5/3/1999 - 7/7/2000,PARK AVENUE SECURITIES LLC (46173)
114473,1541049,IRA,[],BARNETT,,,,,4/15/1994 - 5/3/1999,GUARDIAN INVESTOR SERVICES CORPORATION (6635)
114473,1541049,IRA,[],BARNETT,,,,,10/4/1988 - 5/16/1994,SUN INVESTMENT SERVICES COMPANY (5496)
