FIRM_ID,ID,FIRST_NAME,OTHER_NAMES,SECOND_NAME,DISCLOSURE_DATE,DISCLOSURE_TYPE,DISCLOSURE_RESULT,DISCLOSURE_INFO,FINRA_EMPLOYMENT_DATES,FINRA_EMPLOYMENT
10409,1676849,CRAIG,[],RUTHSATZ,6/25/2020,Employment Separation After Allegations,,"{
  ""Firm Name"" : ""MML INVESTORS SERVICES, LLC"",
  ""Termination Type"" : ""Discharged"",
  ""Allegations"" : ""Registered Representative did not follow firm policy regarding obtaining client signatures.""
}",3/24/2016 - 7/22/2020,"MML INVESTORS SERVICES, LLC (10409)"
10409,1676849,CRAIG,[],RUTHSATZ,,,,,1/3/2014 - 1/18/2016,P.J. ROBB VARIABLE CORPORATION (38339)
10409,1676849,CRAIG,[],RUTHSATZ,,,,,5/19/2011 - 12/31/2013,"BB&T INVESTMENT SERVICES, INC. (33856)"
10409,1676849,CRAIG,[],RUTHSATZ,,,,,4/9/2010 - 5/2/2011,"BB&T INVESTMENT SERVICES, INC. (33856)"
10409,1676849,CRAIG,[],RUTHSATZ,,,,,4/6/2006 - 12/2/2009,"GIRARD SECURITIES, INC. (18697)"
10409,1676849,CRAIG,[],RUTHSATZ,,,,,2/5/1999 - 3/23/2006,"MML INVESTORS SERVICES, INC. (10409)"
10409,1676849,CRAIG,[],RUTHSATZ,,,,,3/27/1995 - 7/27/1998,"NATIONWIDE ADVISORY SERVICES, INC. (11173)"
10409,1676849,CRAIG,[],RUTHSATZ,,,,,9/8/1987 - 3/20/1995,METLIFE SECURITIES INC. (14251)
10409,1676849,CRAIG,[],RUTHSATZ,,,,,9/8/1987 - 3/20/1995,METROPOLITAN LIFE INSURANCE COMPANY (4095)
