FIRM_ID,ID,FIRST_NAME,OTHER_NAMES,SECOND_NAME,DISCLOSURE_DATE,DISCLOSURE_TYPE,DISCLOSURE_RESULT,DISCLOSURE_INFO,FINRA_EMPLOYMENT_DATES,FINRA_EMPLOYMENT
107319,1826692,JAMES,"[JAMES R CLARK, JIM  CLARK]",CLARK,4/15/2011,Financial,Final,"{
  ""Type"" : ""SHORT SALE"",
  ""Disposition"" : ""Satisfied/Released"",
  ""Broker Comment"" : ""THE SHORT SALE WAS DUE TO DETIZIORATED MARKET CONDITIONS, WE HAD PURCHASED THE PROPERTY TO USE AS THE DEVELOPMETS SALES MODEL""
}",6/7/2013 - 12/8/2017,"TRANSAMERICA RETIREMENT ADVISORS, LLC (107319)"
107319,1826692,JAMES,"[JAMES R CLARK, JIM  CLARK]",CLARK,,,,,4/3/2012 - 12/8/2017,TRANSAMERICA INVESTORS SECURITIES CORPORATION (32205)
107319,1826692,JAMES,"[JAMES R CLARK, JIM  CLARK]",CLARK,,,,,11/23/2011 - 3/8/2012,"ROYAL ALLIANCE ASSOCIATES, INC. (23131)"
107319,1826692,JAMES,"[JAMES R CLARK, JIM  CLARK]",CLARK,,,,,4/14/1992 - 12/31/1993,"MARINER FINANCIAL SERVICES, INC. (8292)"
107319,1826692,JAMES,"[JAMES R CLARK, JIM  CLARK]",CLARK,,,,,12/4/1991 - 5/7/1992,SUN INVESTMENT SERVICES COMPANY (5496)
107319,1826692,JAMES,"[JAMES R CLARK, JIM  CLARK]",CLARK,,,,,3/6/1989 - 2/1/1991,"EQUICO SECURITIES, INC. (6627)"
107319,1826692,JAMES,"[JAMES R CLARK, JIM  CLARK]",CLARK,,,,,3/6/1989 - 2/1/1991,THE EQUITABLE LIFE ASSURANCE SOCIETY OF THE UNITED STATES (4039)
107319,1826692,JAMES,"[JAMES R CLARK, JIM  CLARK]",CLARK,,,,,8/11/1988 - 2/21/1989,"EQUICO SECURITIES, INC. (6627)"
107319,1826692,JAMES,"[JAMES R CLARK, JIM  CLARK]",CLARK,,,,,8/11/1988 - 2/21/1989,THE EQUITABLE LIFE ASSURANCE SOCIETY OF THE UNITED STATES (4039)
