FIRM_ID,ID,FIRST_NAME,OTHER_NAMES,SECOND_NAME,DISCLOSURE_DATE,DISCLOSURE_TYPE,DISCLOSURE_RESULT,DISCLOSURE_INFO,FINRA_EMPLOYMENT_DATES,FINRA_EMPLOYMENT
3487,1962444,KAMI,[],VIDOR,5/7/2020,Employment Separation After Allegations,,"{
  ""Firm Name"" : ""State Farm"",
  ""Termination Type"" : ""Discharged"",
  ""Allegations"" : ""The internal review concluded the individual failed to supervise the team members and ensure proper information was provided to the enterprise during the auto quote process. No securities products involved.""
}",10/17/2018 - 5/11/2020,STATE FARM INVESTMENT MANAGEMENT CORP. (3487)
3487,1962444,KAMI,[],VIDOR,,,,,7/1/2014 - 5/11/2020,STATE FARM VP MANAGEMENT CORP. (43036)
3487,1962444,KAMI,[],VIDOR,,,,,8/21/2007 - 12/13/2013,"ADVISORS ASSET MANAGEMENT, INC. (46727)"
3487,1962444,KAMI,[],VIDOR,,,,,9/28/2005 - 7/12/2007,"USAA FINANCIAL ADVISORS, INC. (129035)"
3487,1962444,KAMI,[],VIDOR,,,,,9/28/2005 - 7/12/2007,USAA FINANCIAL PLANNING SERVICES (106352)
3487,1962444,KAMI,[],VIDOR,,,,,4/27/2005 - 9/6/2005,"WELLS FARGO INVESTMENTS, LLC (10582)"
3487,1962444,KAMI,[],VIDOR,,,,,4/11/2005 - 9/6/2005,"WELLS FARGO INVESTMENTS, LLC (10582)"
