FIRM_ID,ID,FIRST_NAME,OTHER_NAMES,SECOND_NAME,DISCLOSURE_DATE,DISCLOSURE_TYPE,DISCLOSURE_RESULT,DISCLOSURE_INFO,FINRA_EMPLOYMENT_DATES,FINRA_EMPLOYMENT
124234,2030161,MARK,[],FLAHERTY,3/28/1994,Employment Separation After Allegations,,"{
  ""Firm Name"" : ""MERRILL LYNCH, PIERCE, FENNER & SMITH INCORPORATED"",
  ""Termination Type"" : ""Discharged"",
  ""Allegations"" : ""- I ISSUED A LETTER WITHOUT SUPERVISORY APPROVAL, A VIOLATION OF 342.16"",
  ""Broker Comment"" : ""DISCHARGED-TERMINATION  LETTER OF ADMONITION, NO FURTHER DISCIPLINARY ACTION Not Provided""
}",5/17/2017 - 5/7/2019,"US ASSET MANAGEMENT, LLC (124234)"
124234,2030161,MARK,[],FLAHERTY,,,,,6/16/2009 - 3/27/2012,CAMERON CAPITAL MANAGEMENT LLC (142519)
124234,2030161,MARK,[],FLAHERTY,,,,,4/29/1999 - 12/31/2003,"FIRST SECURITY INVESTMENTS, INC. (24035)"
124234,2030161,MARK,[],FLAHERTY,,,,,1/22/1999 - 4/19/1999,"CORPORATE SECURITIES GROUP, INC. (11025)"
124234,2030161,MARK,[],FLAHERTY,,,,,9/3/1998 - 12/31/1998,"CORPORATE SECURITIES GROUP, INC. (11025)"
124234,2030161,MARK,[],FLAHERTY,,,,,7/21/1997 - 9/18/1998,"COPELAND EQUITIES, INC. (7447)"
124234,2030161,MARK,[],FLAHERTY,,,,,3/29/1996 - 7/22/1997,"THE INVESTMENT CENTER, INC. (17839)"
124234,2030161,MARK,[],FLAHERTY,,,,,6/19/1991 - 5/3/1994,"MERRILL LYNCH, PIERCE, FENNER & SMITH INCORPORATED (7691)"
124234,2030161,MARK,[],FLAHERTY,,,,,2/13/1990 - 7/8/1991,"THOMAS M. NIXON & ASSOCIATES, INC. (17047)"
