FIRM_ID,ID,FIRST_NAME,OTHER_NAMES,SECOND_NAME,DISCLOSURE_DATE,DISCLOSURE_TYPE,DISCLOSURE_RESULT,DISCLOSURE_INFO,FINRA_EMPLOYMENT_DATES,FINRA_EMPLOYMENT
19616,2326741,MICHAEL,[],RIHERD,2/15/2011,Employment Separation After Allegations,,"{
  ""Firm Name"" : ""MERRILL LYNCH, PIERCE, FENNER AND SMITH, INC."",
  ""Termination Type"" : ""Discharged"",
  ""Allegations"" : ""CONDUCT IN CONTRAVENTION OF FIRM POLICIES REGARDING USING AN APPROVED ACCOUNT PERFORMANCE REPORT, PLACING MUTUAL FUND ORDERS AND EXCERCISING DISCRETION."",
  ""Broker Comment"" : ""NO CLIENT SUFFERED ANY INJURY, FINANCIAL OR OTHERWISE, AS A RESULT OF ANY OF MY ACTIONS, AND NO CLIENT COMPLAINED ABOUT ANY OF MY ACTIONS INCLUDING THOSE THAT LED TO MY TERMINATION.  FURTHERMORE, THE CLIENT WHOSE TRANSACTION WAS AT ISSUE STRONGLY OBJECTS TO THE CHARGES OF ANY WRONGDOING BY ME BECAUSE I WAS COMPLYING WITH THAT CLIENT'S SPECIFIC REQUEST.""
}",3/18/2011 - Current,"WELLS FARGO CLEARING SERVICES, LLC (19616)"
19616,2326741,MICHAEL,[],RIHERD,,,,,11/12/2004 - 3/11/2011,"MERRILL LYNCH, PIERCE, FENNER & SMITH INCORPORATED (7691)"
19616,2326741,MICHAEL,[],RIHERD,,,,,12/7/2000 - 11/30/2004,"SANFORD C. BERNSTEIN & CO., LLC (104474)"
19616,2326741,MICHAEL,[],RIHERD,,,,,7/8/1997 - 11/30/2004,ALLIANCE CAPITAL MANAGEMENT L P (108477)
19616,2326741,MICHAEL,[],RIHERD,,,,,5/5/1993 - 12/7/2000,"SANFORD C. BERNSTEIN & CO., INC. (1232)"
