FIRM_ID,ID,FIRST_NAME,OTHER_NAMES,SECOND_NAME,DISCLOSURE_DATE,DISCLOSURE_TYPE,DISCLOSURE_RESULT,DISCLOSURE_INFO,FINRA_EMPLOYMENT_DATES,FINRA_EMPLOYMENT
628,2517921,JOHN,"[JAY  NELSON, JOHN DENNIS NELSON]",NELSON,11/3/2011,Financial,Final,"{
  ""Type"" : ""Bankruptcy"",
  ""Disposition"" : ""Discharged"",
  ""Broker Comment"" : ""IN OCTOBER OF 2008, I LOST MY POSITION AS BUSINESS BANKER DUE TO DOWNSIZING OF THE RETAIL BANK OPERATIONS. I BEGAN WORKING AS INSURANCE AGENT IN APRIL 2009 AT AN INCOME LEVEL AT 50% OF MY PREVIOUS POSITION. PRIOR TO THE CHANGE IN JOBS, WE HAD VERY LARGE AMOUNT OF UNSECURED DEBT THAT WE COULD NO LONGER SERVICE WITH SUCH A SIGNIFICANT DECREASE OF INCOME. THEREFORE, WE FOUND IT NECESSARY TO FILE FOR BANKRUPTCY IN NOVEMBER OF 2011. EVEN THOUGH THEY WERE LISTED AS DEBTORS, WE REINSTATED OUR DEBT WITH OUR MORTGAGE COMPANY AND AUTO LOAN LENDER TO KEEP THOSE ASSETS & DEBTS CURRENT.""
}",3/26/2015 - 1/25/2016,"FIFTH THIRD SECURITIES, INC. (628)"
628,2517921,JOHN,"[JAY  NELSON, JOHN DENNIS NELSON]",NELSON,,,,,4/18/2013 - 1/6/2015,"ALLSTATE FINANCIAL SERVICES, LLC (18272)"
628,2517921,JOHN,"[JAY  NELSON, JOHN DENNIS NELSON]",NELSON,,,,,9/16/2004 - 9/21/2006,"FIFTH THIRD SECURITIES, INC. (628)"
628,2517921,JOHN,"[JAY  NELSON, JOHN DENNIS NELSON]",NELSON,,,,,1/2/2002 - 3/31/2004,"AMSOUTH INVESTMENT SERVICES, INC. (15692)"
628,2517921,JOHN,"[JAY  NELSON, JOHN DENNIS NELSON]",NELSON,,,,,2/14/2000 - 12/4/2000,"AMSOUTH INVESTMENT SERVICES, INC. (15692)"
628,2517921,JOHN,"[JAY  NELSON, JOHN DENNIS NELSON]",NELSON,,,,,2/1/1997 - 2/14/2000,INVEST FINANCIAL CORPORATION (12984)
628,2517921,JOHN,"[JAY  NELSON, JOHN DENNIS NELSON]",NELSON,,,,,7/28/1994 - 2/1/1997,"AMERISTAR CAPITAL MARKETS, INC. (17068)"
