FIRM_ID,ID,FIRST_NAME,OTHER_NAMES,SECOND_NAME,DISCLOSURE_DATE,DISCLOSURE_TYPE,DISCLOSURE_RESULT,DISCLOSURE_INFO,FINRA_EMPLOYMENT_DATES,FINRA_EMPLOYMENT
1254,2677279,NICOLE,[],VUU,7/20/2012,Employment Separation After Allegations,,"{
  ""Firm Name"" : ""U.S. BANK, AFFILIATE OF U.S. BANCORP INVESTMENTS, INC."",
  ""Termination Type"" : ""Discharged"",
  ""Allegations"" : ""EMPLOYEE WAS DISCHARGED AFTER THE BANK AFFILIATE DEVELOPED FACTS THAT PROVIDED A REASONABLE BASIS TO BELIEVE THAT THE REP PLACED CUSTOMER SIGNATURES ON BANK DOCUMENTS."",
  ""Broker Comment"" : ""ACCUSED OF PLACING CLIENT SIGNATURE ON LOAN COVER SHEET.  HOWEVER, CLIENT WROTE LETTER GIVING PERMISSION TO ACT ON THEIR BEHALF WHILE THEY WERE OUT OF TOUCH.  THERE WERE NO MALICIOUS INTENT OR PERSONAL GAIN FROM THIS INCIDENT.  NO CLIENT COMPLAINT. NOT INVESTMENT RELATED.""
}",5/15/2019 - 12/6/2019,"UMPQUA INVESTMENTS, INC. (1254)"
1254,2677279,NICOLE,[],VUU,,,,,11/15/2016 - 4/11/2019,"UNIONBANC INVESTMENT SERVICES, LLC (14455)"
1254,2677279,NICOLE,[],VUU,,,,,9/15/2010 - 8/14/2012,"U.S. BANCORP INVESTMENTS, INC. (17868)"
1254,2677279,NICOLE,[],VUU,,,,,7/12/1999 - 4/28/2009,"BANC OF AMERICA INVESTMENT SERVICES, INC. (16361)"
1254,2677279,NICOLE,[],VUU,,,,,7/1/1998 - 7/12/1999,"BA INVESTMENT SERVICES, INC. (12965)"
1254,2677279,NICOLE,[],VUU,,,,,7/1/1998 - 4/28/2009,"BANC OF AMERICA INVESTMENT SERVICES, INC. (16361)"
1254,2677279,NICOLE,[],VUU,,,,,2/27/1997 - 7/1/1998,"SEAFIRST INVESTMENT SERVICES, INC. (17411)"
