FIRM_ID,ID,FIRST_NAME,OTHER_NAMES,SECOND_NAME,DISCLOSURE_DATE,DISCLOSURE_TYPE,DISCLOSURE_RESULT,DISCLOSURE_INFO,FINRA_EMPLOYMENT_DATES,FINRA_EMPLOYMENT
16164,2717070,Alvin,[ALVIN  LEAKS],Leaks,8/10/2018,Judgment / Lien,,"{
  ""Judgment/Lien Amount"" : ""$6,172.74"",
  ""Judgment/Lien Type"" : ""Tax""
}",10/1/2019 - 5/29/2020,"TRANSAMERICA FINANCIAL ADVISORS, INC (16164)"
16164,2717070,Alvin,[ALVIN  LEAKS],Leaks,,,,,10/26/2018 - 5/17/2019,"TRANSAMERICA FINANCIAL ADVISORS, INC (16164)"
16164,2717070,Alvin,[ALVIN  LEAKS],Leaks,,,,,7/20/2016 - 11/17/2016,"VALIC FINANCIAL ADVISORS, INC. (42803)"
16164,2717070,Alvin,[ALVIN  LEAKS],Leaks,,,,,8/28/2015 - 6/15/2016,CAPE SECURITIES INC. (7072)
16164,2717070,Alvin,[ALVIN  LEAKS],Leaks,,,,,5/2/2012 - 4/30/2014,PRUDENTIAL INVESTMENT MANAGEMENT SERVICES LLC (18353)
16164,2717070,Alvin,[ALVIN  LEAKS],Leaks,,,,,8/27/2008 - 10/9/2009,LINCOLN FINANCIAL ADVISORS CORPORATION (3978)
16164,2717070,Alvin,[ALVIN  LEAKS],Leaks,,,,,1/7/2008 - 5/30/2008,"NATIONWIDE INVESTMENT ADVISORS, LLC (142373)"
16164,2717070,Alvin,[ALVIN  LEAKS],Leaks,,,,,6/11/1998 - 6/2/2008,NATIONWIDE INVESTMENT SERVICES CORPORATION (7110)
