FIRM_ID,ID,FIRST_NAME,OTHER_NAMES,SECOND_NAME,DISCLOSURE_DATE,DISCLOSURE_TYPE,DISCLOSURE_RESULT,DISCLOSURE_INFO,FINRA_EMPLOYMENT_DATES,FINRA_EMPLOYMENT
31194,2783839,SHAHIDA,[SHAHIDA ARUNIMA SYEDA],HOSSAIN,5/11/2020,Employment Separation After Allegations,,"{
  ""Firm Name"" : ""RBC Capital Markets, LLC"",
  ""Termination Type"" : ""Discharged"",
  ""Allegations"" : ""The Financial Advisor admitted to failing to follow management directive requiring Firm consent prior to entering any option orders.""
}",12/19/2016 - 5/27/2020,"RBC CAPITAL MARKETS, LLC (31194)"
31194,2783839,SHAHIDA,[SHAHIDA ARUNIMA SYEDA],HOSSAIN,,,,,4/24/2006 - 1/12/2017,"WELLS FARGO CLEARING SERVICES, LLC (19616)"
31194,2783839,SHAHIDA,[SHAHIDA ARUNIMA SYEDA],HOSSAIN,,,,,11/25/2003 - 1/12/2017,"WELLS FARGO CLEARING SERVICES, LLC (19616)"
31194,2783839,SHAHIDA,[SHAHIDA ARUNIMA SYEDA],HOSSAIN,,,,,5/3/1999 - 12/11/2003,"J.J.B. HILLIARD, W.L. LYONS, INC. (453)"
31194,2783839,SHAHIDA,[SHAHIDA ARUNIMA SYEDA],HOSSAIN,,,,,2/13/1998 - 4/26/1999,PAINEWEBBER INCORPORATED (8174)
31194,2783839,SHAHIDA,[SHAHIDA ARUNIMA SYEDA],HOSSAIN,,,,,9/10/1996 - 2/17/1998,FIRST OF MICHIGAN CORPORATION (311)
