FIRM_ID,ID,FIRST_NAME,OTHER_NAMES,SECOND_NAME,DISCLOSURE_DATE,DISCLOSURE_TYPE,DISCLOSURE_RESULT,DISCLOSURE_INFO,FINRA_EMPLOYMENT_DATES,FINRA_EMPLOYMENT
21570,2922075,Geoffrey,[GEOFFREY TODD GIBSON],Gibson,11/30/2012,Financial,Final,"{
  ""Type"" : ""Compromise"",
  ""Disposition"" : ""Satisfied/Released"",
  ""Broker Comment"" : ""PURCHASED A HOME WITH AN INTEREST ONLY LOAN FOR FOUR YEARS. COMPANIES REFUSED TO RESTRUCTURE LOAN WITH US.  LOAN PAYMENT WAS GOING TO INCREASE TO INCLUDE INTEREST ONLY PAYMENT PLUS PRINCIPAL. FINANCIALLY THE HOUSE WOULD NOT HAVE BEEN AFFORDABLE AT CURRENT TERMS. DECISION WAS MADE TO SHORT SALE THE HOUSE AND WE WORKED WITH LENDERS TO RESOLVE THE SALE IN THE BEST INTEREST OF BOTH PARTIES. THE LOANS WERE FORGIVEN AS SETTLED FOR LESS THAN THE AMOUNT OWED.""
}",10/10/2018 - 12/21/2020,"PRUDENTIAL ANNUITIES DISTRIBUTORS, INC (21570)"
21570,2922075,Geoffrey,[GEOFFREY TODD GIBSON],Gibson,,,,,9/7/2017 - 10/1/2018,"ICON DISTRIBUTORS, INC. (28568)"
21570,2922075,Geoffrey,[GEOFFREY TODD GIBSON],Gibson,,,,,7/14/2010 - 8/7/2017,"PACIFIC SELECT DISTRIBUTORS, LLC (4452)"
21570,2922075,Geoffrey,[GEOFFREY TODD GIBSON],Gibson,,,,,9/29/2008 - 11/10/2009,J.P. MORGAN ASSET MANAGEMENT (107038)
21570,2922075,Geoffrey,[GEOFFREY TODD GIBSON],Gibson,,,,,9/22/2008 - 4/5/2010,"JPMORGAN DISTRIBUTION SERVICES, INC. (104234)"
21570,2922075,Geoffrey,[GEOFFREY TODD GIBSON],Gibson,,,,,4/27/2007 - 5/20/2008,JACKSON NATIONAL LIFE DISTRIBUTORS LLC (40178)
21570,2922075,Geoffrey,[GEOFFREY TODD GIBSON],Gibson,,,,,6/18/2002 - 5/1/2007,"ALLIANZ LIFE FINANCIAL SERVICES, LLC (612)"
21570,2922075,Geoffrey,[GEOFFREY TODD GIBSON],Gibson,,,,,4/6/2001 - 5/8/2002,"SUNAMERICA CAPITAL SERVICES, INC. (13158)"
21570,2922075,Geoffrey,[GEOFFREY TODD GIBSON],Gibson,,,,,1/29/1999 - 2/23/2001,DEAN WITTER REYNOLDS INC. (7556)
