FIRM_ID,ID,FIRST_NAME,OTHER_NAMES,SECOND_NAME,DISCLOSURE_DATE,DISCLOSURE_TYPE,DISCLOSURE_RESULT,DISCLOSURE_INFO,FINRA_EMPLOYMENT_DATES,FINRA_EMPLOYMENT
3487,3046272,SHAWN,[],WILKINS,2/19/1976,Criminal,Final Disposition,"{
  ""criminalCharges"" : [ {
    ""Charges"" : ""CONSPIRACY, TRANSPORT OF STOLEN SECUTITIES, FRAUD"",
    ""Disposition"" : ""CHARGED WITH FELONY (CONSPIRACY, TRANSPORT OF STOLEN SECURITIES, FRAUD BY WIRE), WENT TO COURT IN THE WESTERN DISTRICT FEDERAL COURT ST LOUIS  MO AND WAS FOUND NOT GUILTY. CHARGES WERE FOUND TO BE FALSE AND THE PERSON WHO BROUGHT CHARGES LIED ON THE WITNESS STAND.""
  } ],
  ""Broker Comment"" : ""MOTHER OF A CLIENT CALLED ME AND ASKED ME TO HELP HER FIND HER SON WHO WAS FLYING IN AND OUT OF MEXICO ILLEGALLY. SHE PAID MY EXPENSES AND LATER WHEN I COULDN'T FIND HIM (HE CRASHED HIS PLANE AND WAS KILLED; DIED DURING THE TIME I WAS LOOKING FOR HIM), SHE ACCUSED ME OF KNOWING HE WAS DEAD. SHE TOLD LOCAL SHERIFF (ALSO A MISCOMMUNICATOR OF TRUTH & IMPEACHED FROM OFFICE) & HE CALLED FBI. I HAD PRESIDENT OF BANK AS MY WITNESS AND CASE WAS SEALED W/NOT GUILTY VERDICT. IN MAY 1976""
}",9/6/2018 - Current,STATE FARM INVESTMENT MANAGEMENT CORP. (3487)
3487,3046272,SHAWN,[],WILKINS,,,,,5/14/1998 - Current,STATE FARM VP MANAGEMENT CORP. (43036)
