FIRM_ID,ID,FIRST_NAME,OTHER_NAMES,SECOND_NAME,DISCLOSURE_DATE,DISCLOSURE_TYPE,DISCLOSURE_RESULT,DISCLOSURE_INFO,FINRA_EMPLOYMENT_DATES,FINRA_EMPLOYMENT
42803,4370233,ENOCH,[],BOOTH,12/18/2020,Employment Separation After Allegations,,"{
  ""Firm Name"" : ""VALIC Financial Advisors, Inc."",
  ""Termination Type"" : ""Discharged"",
  ""Allegations"" : ""Mr. Booth was terminated for failing to disclose a series of private securities transactions, failing to disclose a self-directed IRA, and providing gift cards to clients in violation of Firm policy.""
}",4/25/2003 - 1/12/2021,"VALIC FINANCIAL ADVISORS, INC. (42803)"
42803,4370233,ENOCH,[],BOOTH,,,,,5/3/2001 - 1/12/2021,"VALIC FINANCIAL ADVISORS, INC. (42803)"
42803,4370233,ENOCH,[],BOOTH,,,,,5/3/2001 - 12/31/2001,THE VARIABLE ANNUITY MARKETING COMPANY (5081)
