FIRM_ID,ID,FIRST_NAME,OTHER_NAMES,SECOND_NAME,DISCLOSURE_DATE,DISCLOSURE_TYPE,DISCLOSURE_RESULT,DISCLOSURE_INFO,FINRA_EMPLOYMENT_DATES,FINRA_EMPLOYMENT
300626,4441762,GREGORY,[],COHN,10/9/2007,Employment Separation After Allegations,,"{
  ""Firm Name"" : ""NAVIGANT CAPITAL ADVISORS, LLC"",
  ""Termination Type"" : ""Voluntary Resignation"",
  ""Allegations"" : ""THE ASSOCIATED PERSON RESIGNED ON 10/9/07 AFTER BEING NOTIFIED THAT HE WAS THE SUBJECT OF AN INTERNAL REVIEW FOR, AMONG OTHER REASONS, PARTICIPATING IN A PRIVATE SECURITIES TRANSACTION WITHOUT PROVIDING WRITTEN NOTICE TO OR RECEIVING APPROVAL FROM THE FIRM AS REQUIRED BY FINRA RULE 3040."",
  ""Broker Comment"" : ""AT THE TIME OF HIS VOLUNTARY TERMINATION, MR. COHN WAS NOT NOTIFIED OR AWARE THAT HE WAS THE SUBJECT OF AN INTERNAL REVIEW. MR. COHN WAS NOT AWARE OF HIS PARTICIPATION IN ANY PRIVATE SECURITIES TRANSACTIONS. HE UNDERSTOOD ALL WORK HE WAS PERFORMING WAS FOR FIRM CLIENTS. NAVIGANT CAPITAL ADVISORS LLC (\""NAVIGANT\"") STATES THAT THE ASSOCIATED PERSON VOLUNTARILY RESIGNED PRIOR TO THE CONCLUSION OF THE INTERNAL REVIEW WHICH WAS INITIATED TO DETERMINE WHETHER THE ASSOCIATED PERSON PARTICIPATED IN A PRIVATE SECURITIES TRANSACTION WITHOUT PROVIDING WRITTEN NOTICE TO OR RECEIVING APPROVAL FROM THE FIRM AS REQUIRED BY FINRA RULE 3040. FOLLOWING NAVIGANT'S SUBMISSION OF MR. COHN'S FORM U-5, NAVIGANT PURSUED FURTHER INVESTIGATION OF THE MATTER. THIS INVESTIGATION AND FINRA'S INVESTIGATION AND DETERMINATION NOT TO PURSUE DISCIPLINARY ACTION AGAINST MR. COHN HAS REVEALED THAT MR. COHN'S CONDUCT AT ISSUE IMPLICATED VIOLATIONS OF COMPANY POLICY RATHER THAN VIOLATIONS OF FINRA RULE 3040. MR. COHN FULLY COOPERATED WITH THE INVESTIGATION.""
}",4/25/2019 - Current,"MAVEN CAPITAL PARTNERS, LLC (300626)"
300626,4441762,GREGORY,[],COHN,,,,,11/21/2018 - Current,MCA SECURITIES LLC (298069)
300626,4441762,GREGORY,[],COHN,,,,,3/7/2018 - 12/6/2018,"BRIDGE CAPITAL ASSOCIATES, INC. (143475)"
300626,4441762,GREGORY,[],COHN,,,,,9/25/2015 - 2/12/2018,PNC CAPITAL ADVISORS LLC (151829)
300626,4441762,GREGORY,[],COHN,,,,,7/17/2015 - 2/13/2018,"PNC FUNDS DISTRIBUTOR, LLC (118787)"
300626,4441762,GREGORY,[],COHN,,,,,4/19/2005 - 10/11/2007,"NAVIGANT CAPITAL ADVISORS, LLC (114155)"
300626,4441762,GREGORY,[],COHN,,,,,11/22/2004 - 4/15/2005,"CBW SECURITIES, LLC (132023)"
300626,4441762,GREGORY,[],COHN,,,,,10/8/2001 - 12/17/2002,"DONALDSON, LUFKIN & JENRETTE SECURITIES CORPORATION (7560)"
