FIRM_ID,ID,FIRST_NAME,OTHER_NAMES,SECOND_NAME,DISCLOSURE_DATE,DISCLOSURE_TYPE,DISCLOSURE_RESULT,DISCLOSURE_INFO,FINRA_EMPLOYMENT_DATES,FINRA_EMPLOYMENT
125004,4465326,JEFFREY,[J CHETT CARTER],CARTER,12/19/2013,Judgment / Lien,,"{
  ""Judgment/Lien Amount"" : ""$9,413.07"",
  ""Judgment/Lien Type"" : ""Tax"",
  ""Broker Comment"" : ""LOW INCOME RESULTED IN FALLING BEHIND IN TAX ESTIMATED PAYMENTS AND PAYMENT OF BALANCES OWING FOR TAX YEARS 2009, 2011, AND 2012.  I AM MAKING TIMELY PAYMENTS AND HOPE TO HAVE THIS DEBT PAID OFF WITHIN 24MONTHS.""
}",3/29/2017 - 3/27/2018,REGAL INVESTMENT ADVISORS LLC (125004)
125004,4465326,JEFFREY,[J CHETT CARTER],CARTER,,,,,1/25/2017 - 3/29/2017,"WEALTH WATCH ADVISORS, LLC (172002)"
125004,4465326,JEFFREY,[J CHETT CARTER],CARTER,,,,,9/4/2014 - 12/31/2015,THE O.N. EQUITY SALES COMPANY (2936)
125004,4465326,JEFFREY,[J CHETT CARTER],CARTER,,,,,3/29/2011 - 3/7/2013,PARK AVENUE SECURITIES LLC (46173)
125004,4465326,JEFFREY,[J CHETT CARTER],CARTER,,,,,2/19/2003 - 3/7/2013,PARK AVENUE SECURITIES LLC (46173)
125004,4465326,JEFFREY,[J CHETT CARTER],CARTER,,,,,4/3/2002 - 9/5/2002,"NORTHWESTERN MUTUAL INVESTMENT SERVICES, LLC (2881)"
