FIRM_ID,ID,FIRST_NAME,OTHER_NAMES,SECOND_NAME,DISCLOSURE_DATE,DISCLOSURE_TYPE,DISCLOSURE_RESULT,DISCLOSURE_INFO,FINRA_EMPLOYMENT_DATES,FINRA_EMPLOYMENT
421,4470500,PAUL,[NICK  BEHNKE],BEHNKE,10/11/2013,Financial,Final,"{
  ""Type"" : ""Compromise"",
  ""Disposition"" : ""Satisfied/Released""
}",9/15/2014 - Current,"WOODBURY FINANCIAL SERVICES, INC. (421)"
421,4470500,PAUL,[NICK  BEHNKE],BEHNKE,,,,,7/18/2012 - 9/20/2012,"AUSDAL FINANCIAL PARTNERS, INC. (7995)"
421,4470500,PAUL,[NICK  BEHNKE],BEHNKE,,,,,7/13/2012 - 9/20/2012,"AUSDAL FINANCIAL PARTNERS, INC. (7995)"
421,4470500,PAUL,[NICK  BEHNKE],BEHNKE,,,,,4/5/2010 - 9/25/2014,"LANDOLT SECURITIES, INC. (28352)"
421,4470500,PAUL,[NICK  BEHNKE],BEHNKE,,,,,11/4/2009 - 4/13/2010,"M&I FINANCIAL ADVISORS, INC (16517)"
421,4470500,PAUL,[NICK  BEHNKE],BEHNKE,,,,,8/7/2009 - 10/30/2009,"U.S. BANCORP INVESTMENTS, INC. (17868)"
421,4470500,PAUL,[NICK  BEHNKE],BEHNKE,,,,,11/29/2005 - 8/6/2009,"M&I FINANCIAL ADVISORS, INC (16517)"
421,4470500,PAUL,[NICK  BEHNKE],BEHNKE,,,,,10/22/2004 - 11/29/2005,MORGAN STANLEY DW INC. (7556)
421,4470500,PAUL,[NICK  BEHNKE],BEHNKE,,,,,1/1/2002 - 11/1/2004,CITIGROUP GLOBAL MARKETS INC. (7059)
