FIRM_ID,ID,FIRST_NAME,OTHER_NAMES,SECOND_NAME,DISCLOSURE_DATE,DISCLOSURE_TYPE,DISCLOSURE_RESULT,DISCLOSURE_INFO,FINRA_EMPLOYMENT_DATES,FINRA_EMPLOYMENT
42803,4643719,Rodrigo,[],Trujillo,5/12/2015,Financial,Final,"{
  ""Type"" : ""Compromise"",
  ""Disposition"" : ""Satisfied/Released""
}",2/19/2018 - 6/7/2018,"VALIC FINANCIAL ADVISORS, INC. (42803)"
42803,4643719,Rodrigo,[],Trujillo,,,,,2/16/2018 - 6/7/2018,"VALIC FINANCIAL ADVISORS, INC. (42803)"
42803,4643719,Rodrigo,[],Trujillo,,,,,4/7/2017 - 10/13/2017,"MERRILL LYNCH, PIERCE, FENNER & SMITH INCORPORATED (7691)"
42803,4643719,Rodrigo,[],Trujillo,,,,,3/2/2017 - 10/13/2017,"MERRILL LYNCH, PIERCE, FENNER & SMITH INCORPORATED (7691)"
42803,4643719,Rodrigo,[],Trujillo,,,,,11/15/2004 - 3/29/2005,"MML INVESTORS SERVICES, INC. (10409)"
42803,4643719,Rodrigo,[],Trujillo,,,,,12/9/2003 - 8/23/2004,PRUDENTIAL FINANCIAL PLANNING SERVICES (5685)
42803,4643719,Rodrigo,[],Trujillo,,,,,4/7/2003 - 8/23/2004,"PRUCO SECURITIES, LLC. (5685)"
