FIRM_ID,ID,FIRST_NAME,OTHER_NAMES,SECOND_NAME,DISCLOSURE_DATE,DISCLOSURE_TYPE,DISCLOSURE_RESULT,DISCLOSURE_INFO,FINRA_EMPLOYMENT_DATES,FINRA_EMPLOYMENT
144426,4690105,JOHN,"[J DAVID JENSEN, JOHN D JENSEN]",JENSEN,12/28/2018,Employment Separation After Allegations,,"{
  ""Firm Name"" : ""GLOBAL VIEW CAPITAL MANAGEMENT, LTD."",
  ""Termination Type"" : ""Permitted to Resign"",
  ""Allegations"" : ""GVCM RECEIVED INFORMATION FROM BROKER DEALER (PURSHE KAPLAN STERLING INVESTMENTS (PKSI)) AT WHICH MR. JENSEN WAS ALSO REGISTERED AS A REGISTERED REPRESENTATIVE. THIS INFORMATION INDICATED MR. JENSEN MAY HAVE FAILED TO FOLLOW GVCM POLICIES AND PROCEDURES. IN RESPONSE, GVCM PERMITTED MR. JENSEN TO RESIGN FROM GVCM AND ITS AFFILIATED ENTITIES.""
}",3/6/2019 - Current,"INTERNATIONAL ASSETS INVESTMENT MANAGEMENT, LLC (144426)"
144426,4690105,JOHN,"[J DAVID JENSEN, JOHN D JENSEN]",JENSEN,12/19/2018,Employment Separation After Allegations,,"{
  ""Firm Name"" : ""Purshe Kaplan Sterling Investments"",
  ""Termination Type"" : ""Discharged"",
  ""Allegations"" : ""Mr. Jensen was terminated after PKS received notification from FINRA that an amendment to his investment adviser registration form was filed on December 13, 2018 to disclose an outside business activity.  PKS maintains a policy requiring associated persons to seek approval for outside business activities.  Mr. Jensen previously sought approval for this same activity in July 2018 and received notice that PKS denied this request on October 10, 2018.""
}",2/5/2019 - Current,"INTERNATIONAL ASSETS ADVISORY, LLC (10645)"
144426,4690105,JOHN,"[J DAVID JENSEN, JOHN D JENSEN]",JENSEN,,,,,1/2/2014 - 1/18/2019,PURSHE KAPLAN STERLING INVESTMENTS (35747)
144426,4690105,JOHN,"[J DAVID JENSEN, JOHN D JENSEN]",JENSEN,,,,,1/2/2014 - 1/9/2019,"GLOBAL VIEW CAPITAL MANAGEMENT, LTD (158292)"
144426,4690105,JOHN,"[J DAVID JENSEN, JOHN D JENSEN]",JENSEN,,,,,11/23/2010 - 12/31/2013,THE STRATEGIC FINANCIAL ALLIANCE (126514)
144426,4690105,JOHN,"[J DAVID JENSEN, JOHN D JENSEN]",JENSEN,,,,,11/22/2010 - 12/31/2013,"THE STRATEGIC FINANCIAL ALLIANCE, INC. (126514)"
144426,4690105,JOHN,"[J DAVID JENSEN, JOHN D JENSEN]",JENSEN,,,,,8/8/2006 - 11/19/2010,"INVESTMENT ADVISORS INTERNATIONAL, INC. (139233)"
144426,4690105,JOHN,"[J DAVID JENSEN, JOHN D JENSEN]",JENSEN,,,,,4/11/2006 - 8/25/2006,"INTERSECURITIES, INC. (16164)"
144426,4690105,JOHN,"[J DAVID JENSEN, JOHN D JENSEN]",JENSEN,,,,,1/5/2004 - 11/19/2010,"WORLD GROUP SECURITIES, INC. (114473)"
