FIRM_ID,ID,FIRST_NAME,OTHER_NAMES,SECOND_NAME,DISCLOSURE_DATE,DISCLOSURE_TYPE,DISCLOSURE_RESULT,DISCLOSURE_INFO,FINRA_EMPLOYMENT_DATES,FINRA_EMPLOYMENT
1137,4719242,ROBERT,[ROBERT  SANTINELLI],SANTINELLI,3/18/2015,Customer Dispute,Pending,"{
  ""Allegations"" : ""ALLEGATION ALLEGES MISREPRESENTATION AND OMISSION OF MATERIAL FACTS AWAY FROM THE FIRM WITH THIRD PARTY(S). ACTIVITY DATES: JUNE 2008 TO DECEMBER 2008; IN 2008  CUSTOMER APPROVED PERSONAL LOAN AND COMPLETED THE TRANSACTION WITH BORROWER; 2009, BORROWER DEFAULTED; CUSTOMER PASSED AWAY MARCH 3, 2012; BANKRUPTCY COURT (DEBTOR) 2014; SUITABILITY STANDARD: SATISFIED; ALL MATERIAL FACTS DISCLOSED TO CUSTOMER AND AWARE OF RISK FACTORS BEFORE APPROVING LOANS. LIQUID ASSETS $575K, NET  WORTH $1.1 MILLION.  CUSTOMER WAS NOT CHARGED ANY COMMISSION NOR FEE IN CONNECTION WITH THE LOAN."",
  ""DisplayAAOLinkIfExists"" : ""N"",
  ""arbitrationClaimFiledDetail"" : """",
  ""arbitrationDocketNumber"" : """",
  ""Broker Comment"" : ""IN THE CASE PENDING AGAINST ME IN NEW YORK STATE SUPREME COURT, SUFFOLK COUNTY, THE HON. ELIZABETH EMERSON ISSUED A DECISION & ORDER, DATED SEPTEMBER 18, 2019, DISMISSING THE SEVEN (7) CAUSES OF ACTION AGAINST ME BROUGHT BY THE PLAINTIFF, ESTATE OF [REDACTED], BUT PERMITTED PLAINTIFF TO FILE AN AMENDMENT COMPLAINT ALLEGING AN ADDITIONAL CAUSE OF ACTION FOR AN ALLEGED BREACH OF A LOAN THAT THE DECEDENT HAD MADE TO LAWLINE, INC., A COMPANY THAT I CONTROLLED. HOWEVER, MY ATTORNEYS PRESENTED CLEAR EVIDENCE TO THE COURT THAT THIS LOAN HAD BEEN SATISFIED SINCE I WAS ENTITLED TO RECEIVE MONTHLY FEES FOR CONSULTING WORK THAT I PERFORMED FOR THE DECEDENT. WE EXPECT TO HAVE THIS ADDITIONAL CAUSE OF ACTION DISMISSED VERY SHORTLY.""
}",2/24/2011 - 10/12/2015,PRINCOR FINANCIAL SERVICES CORPORATION (1137)
1137,4719242,ROBERT,[ROBERT  SANTINELLI],SANTINELLI,,,,,2/16/2011 - 10/12/2015,PRINCOR FINANCIAL SERVICES CORPORATION (1137)
1137,4719242,ROBERT,[ROBERT  SANTINELLI],SANTINELLI,,,,,8/6/2009 - 8/18/2010,"MML INVESTORS SERVICES, INC. (10409)"
1137,4719242,ROBERT,[ROBERT  SANTINELLI],SANTINELLI,,,,,4/29/2009 - 8/18/2010,"MML INVESTORS SERVICES, INC. (10409)"
1137,4719242,ROBERT,[ROBERT  SANTINELLI],SANTINELLI,,,,,3/27/2007 - 12/22/2008,"MERRILL LYNCH, PIERCE, FENNER & SMITH INCORPORATED (7691)"
1137,4719242,ROBERT,[ROBERT  SANTINELLI],SANTINELLI,,,,,3/23/2007 - 12/22/2008,"MERRILL LYNCH, PIERCE, FENNER & SMITH INCORPORATED (7691)"
1137,4719242,ROBERT,[ROBERT  SANTINELLI],SANTINELLI,,,,,3/23/2005 - 3/22/2007,MORGAN STANLEY DW INC. (7556)
1137,4719242,ROBERT,[ROBERT  SANTINELLI],SANTINELLI,,,,,7/23/2004 - 3/22/2005,LADENBURG THALMANN ASSET MANAGEMENT INC (108604)
1137,4719242,ROBERT,[ROBERT  SANTINELLI],SANTINELLI,,,,,7/12/2004 - 3/22/2005,"LADENBURG, THALMANN & CO., INC. (505)"
