FIRM_ID,ID,FIRST_NAME,OTHER_NAMES,SECOND_NAME,DISCLOSURE_DATE,DISCLOSURE_TYPE,DISCLOSURE_RESULT,DISCLOSURE_INFO,FINRA_EMPLOYMENT_DATES,FINRA_EMPLOYMENT
3978,4856842,DAVID,[DAVID SCOTT BURMAN],BURMAN,11/28/2016,Employment Separation After Allegations,,"{
  ""Firm Name"" : ""Lincoln Financial Advisors"",
  ""Termination Type"" : ""Discharged"",
  ""Allegations"" : ""The registered administrative assistant was terminated by the RR for whom he worked for using a photocopied signature page on a transfer of asset (TOA) form.  The registered assistant, when confronted on the termination date, admitted the activity and indicated it was isolated.""
}",3/29/2016 - 12/22/2016,LINCOLN FINANCIAL ADVISORS CORPORATION (3978)
3978,4856842,DAVID,[DAVID SCOTT BURMAN],BURMAN,,,,,6/23/2012 - 1/20/2016,"LANDOLT SECURITIES, INC. (28352)"
3978,4856842,DAVID,[DAVID SCOTT BURMAN],BURMAN,,,,,11/24/2008 - 6/4/2012,FIDELITY BROKERAGE SERVICES LLC (7784)
3978,4856842,DAVID,[DAVID SCOTT BURMAN],BURMAN,,,,,6/13/2007 - 7/31/2008,CITIGROUP GLOBAL MARKETS INC. (7059)
3978,4856842,DAVID,[DAVID SCOTT BURMAN],BURMAN,,,,,1/2/2007 - 7/31/2008,CITIGROUP GLOBAL MARKETS INC. (7059)
3978,4856842,DAVID,[DAVID SCOTT BURMAN],BURMAN,,,,,12/10/2004 - 1/12/2006,"T. ROWE PRICE INVESTMENT SERVICES, INC. (8348)"
