FIRM_ID,ID,FIRST_NAME,OTHER_NAMES,SECOND_NAME,DISCLOSURE_DATE,DISCLOSURE_TYPE,DISCLOSURE_RESULT,DISCLOSURE_INFO,FINRA_EMPLOYMENT_DATES,FINRA_EMPLOYMENT
19616,4919938,MICHELLE,[KIEUCHINH THI NGUYEN],NGUYEN,7/10/2014,Employment Separation After Allegations,,"{
  ""Firm Name"" : ""WELLS FARGO ADVISORS, LLC."",
  ""Termination Type"" : ""Discharged"",
  ""Allegations"" : ""DISCHARGED BY WELLS FARGO BANK, NA AFTER ALLEGATIONS WHICH WERE UNRELATED TO THE BUSINESS OF WELLS FARGO ADVISORS, LLC.  SPECIFICALLY, ALLEGATIONS INVOLVED MS. NGUYEN OPENING LINES OF CREDIT FOR BANK CUSTOMERS WITHOUT THE FULL KNOWLEDGE AND CONSENT OF THE BANK CUSTOMER.""
}",8/2/2012 - 7/31/2014,"WELLS FARGO ADVISORS, LLC (19616)"
19616,4919938,MICHELLE,[KIEUCHINH THI NGUYEN],NGUYEN,,,,,7/13/2011 - 10/24/2011,"SIGNATOR INVESTORS, INC. (468)"
19616,4919938,MICHELLE,[KIEUCHINH THI NGUYEN],NGUYEN,,,,,7/25/2007 - 10/19/2007,"H&R BLOCK FINANCIAL ADVISORS, INC. (5979)"
19616,4919938,MICHELLE,[KIEUCHINH THI NGUYEN],NGUYEN,,,,,9/20/2005 - 12/11/2006,"AMSOUTH INVESTMENT SERVICES, INC. (15692)"
19616,4919938,MICHELLE,[KIEUCHINH THI NGUYEN],NGUYEN,,,,,4/1/2005 - 5/2/2005,METLIFE SECURITIES INC. (14251)
19616,4919938,MICHELLE,[KIEUCHINH THI NGUYEN],NGUYEN,,,,,4/1/2005 - 5/2/2005,METROPOLITAN LIFE INSURANCE COMPANY (4095)
