FIRM_ID,ID,FIRST_NAME,OTHER_NAMES,SECOND_NAME,DISCLOSURE_DATE,DISCLOSURE_TYPE,DISCLOSURE_RESULT,DISCLOSURE_INFO,FINRA_EMPLOYMENT_DATES,FINRA_EMPLOYMENT
17868,4933097,Jason,[],Silberman,8/18/2010,Employment Separation After Allegations,,"{
  ""Firm Name"" : ""MERRLL LYNCH, PIERCE, FENNER AND SMITH, INC."",
  ""Termination Type"" : ""Discharged"",
  ""Allegations"" : ""CONDUCT INCONSISTENT WITH FIRM STANDARDS RELATING TO PERSONAL ACCOUNTS."",
  ""Broker Comment"" : ""ALTHOUGH LICENSED, I DID NOT PARTICIPATE IN THE MANAGEMENT OF CLIENT INVESTMENTS.  FURTERMORE, I DID NOT MAINTAIN ANY PERSONAL INVESTMENT ACCOUNTS AT THE FIRM.  I ACTED SOLELY IN A BANKING CAPACITY.""
}",9/1/2017 - Current,"U.S. BANCORP INVESTMENTS, INC. (17868)"
17868,4933097,Jason,[],Silberman,,,,,5/20/2014 - 6/14/2017,CITIGROUP GLOBAL MARKETS INC. (7059)
17868,4933097,Jason,[],Silberman,,,,,10/23/2012 - 4/14/2014,"UNIONBANC INVESTMENT SERVICES, LLC (14455)"
17868,4933097,Jason,[],Silberman,,,,,10/18/2012 - 4/14/2014,"UNIONBANC INVESTMENT SERVICES, LLC (14455)"
17868,4933097,Jason,[],Silberman,,,,,2/15/2011 - 3/19/2012,"WELLS FARGO ADVISORS, LLC (19616)"
17868,4933097,Jason,[],Silberman,,,,,6/10/2010 - 9/16/2010,"MERRILL LYNCH, PIERCE, FENNER & SMITH INCORPORATED (7691)"
17868,4933097,Jason,[],Silberman,,,,,10/23/2009 - 9/16/2010,"MERRILL LYNCH, PIERCE, FENNER & SMITH INCORPORATED (7691)"
17868,4933097,Jason,[],Silberman,,,,,1/1/2007 - 10/23/2009,"BANC OF AMERICA INVESTMENT SERVICES, INC. (16361)"
