FIRM_ID,ID,FIRST_NAME,OTHER_NAMES,SECOND_NAME,DISCLOSURE_DATE,DISCLOSURE_TYPE,DISCLOSURE_RESULT,DISCLOSURE_INFO,FINRA_EMPLOYMENT_DATES,FINRA_EMPLOYMENT
8348,5079369,Serina,"[SERINA N/A COPANAS, SERINA  GAGLIARDI, SERINA  TOURTELOT]",Copanas,10/3/1991,Criminal,Final Disposition,"{
  ""criminalCharges"" : [ {
    ""Charges"" : ""FALSE REPORTING, 1 COUNT, MISDEMEANOR, PLED ADULT DIVERSION, NOT INVESTMENT RELATED."",
    ""Charge Type"" : ""MISDEMEANOR"",
    ""Disposition"" : ""DISMISSED, 5/01/1992, SENTENCED TO COUNSELING, 6 MONTHS, STARTED 11/01/1991, NO OTHER FINE OR PENALTY.""
  } ],
  ""Broker Comment"" : ""AN ERROR IN JUDGEMENT LED TO USING A FAKE ID TO ENTER A BAR.  I WAS UNAWARE THAT THIS WAS A FORM OF FALSE REPORTING.""
}",11/2/2020 - Current,"T. ROWE PRICE INVESTMENT SERVICES, INC. (8348)"
8348,5079369,Serina,"[SERINA N/A COPANAS, SERINA  GAGLIARDI, SERINA  TOURTELOT]",Copanas,,,,,3/5/2019 - 2/24/2020,"T. ROWE PRICE INVESTMENT SERVICES, INC. (8348)"
8348,5079369,Serina,"[SERINA N/A COPANAS, SERINA  GAGLIARDI, SERINA  TOURTELOT]",Copanas,,,,,11/9/2006 - 2/19/2019,"OPPENHEIMERFUNDS DISTRIBUTOR, INC. (7834)"
