FIRM_ID,ID,FIRST_NAME,OTHER_NAMES,SECOND_NAME,DISCLOSURE_DATE,DISCLOSURE_TYPE,DISCLOSURE_RESULT,DISCLOSURE_INFO,FINRA_EMPLOYMENT_DATES,FINRA_EMPLOYMENT
42803,5318174,MICHAEL,[],KREGER,7/31/2014,Employment Separation After Allegations,,"{
  ""Firm Name"" : ""JPMORGAN CHASE BANK"",
  ""Termination Type"" : ""Discharged"",
  ""Allegations"" : ""TERMINATED BY AFFILIATE BANK - NON SECURITIES RELATED. REGISTERED REP, IN THE CAPACITY OF AN AFFILIATE BANK EMPLOYEE, ENTERED INACCURATE INFORMATION INTO A BANK SYSTEM RELATED TO A BANK CUSTOMER ID WHEN OPENING A BANK ACCOUNT."",
  ""Broker Comment"" : ""I THOUGHT THE FORM OF ID I WAS USING WAS ACCEPTABLE AND DID NOT MAKE THIS MISTAKE MALICIOUSLY OR WITH ILL INTENT.""
}",10/14/2014 - Current,"VALIC FINANCIAL ADVISORS, INC. (42803)"
42803,5318174,MICHAEL,[],KREGER,,,,,10/1/2014 - Current,"VALIC FINANCIAL ADVISORS, INC. (42803)"
42803,5318174,MICHAEL,[],KREGER,,,,,10/1/2012 - 8/22/2014,J.P. MORGAN SECURITIES LLC (79)
42803,5318174,MICHAEL,[],KREGER,,,,,4/19/2007 - 10/1/2012,CHASE INVESTMENT SERVICES CORP. (25574)
