FIRM_ID,ID,FIRST_NAME,OTHER_NAMES,SECOND_NAME,DISCLOSURE_DATE,DISCLOSURE_TYPE,DISCLOSURE_RESULT,DISCLOSURE_INFO,FINRA_EMPLOYMENT_DATES,FINRA_EMPLOYMENT
110757,5344957,BRITTANY,"[BRITTANY  MOLYET, BRITTANY JO TRUSNER]",MOLYET,11/30/2009,Judgment / Lien,,"{
  ""Judgment/Lien Amount"" : ""$2,068.59"",
  ""Judgment/Lien Type"" : ""Civil"",
  ""Broker Comment"" : ""Ms. Molyet was a co-signor on an account and was not notified of a judgement until recently as she had moved to a different state. It should be noted that this record does not show up on a background or credit check. She has notified the holder of the debt, who is contacting for settlement.""
}",2/3/2015 - 3/20/2018,"GREAT LAKES ADVISORS, LLC (110757)"
110757,5344957,BRITTANY,"[BRITTANY  MOLYET, BRITTANY JO TRUSNER]",MOLYET,,,,,7/20/2012 - 7/29/2016,WAYNE HUMMER INVESTMENTS L.L.C. (875)
110757,5344957,BRITTANY,"[BRITTANY  MOLYET, BRITTANY JO TRUSNER]",MOLYET,,,,,5/17/2012 - 7/29/2016,WAYNE HUMMER INVESTMENTS L.L.C. (875)
110757,5344957,BRITTANY,"[BRITTANY  MOLYET, BRITTANY JO TRUSNER]",MOLYET,,,,,3/24/2010 - 5/3/2012,J.P. MORGAN SECURITIES LLC (79)
110757,5344957,BRITTANY,"[BRITTANY  MOLYET, BRITTANY JO TRUSNER]",MOLYET,,,,,4/8/2008 - 3/15/2010,"J.J.B. HILLIARD, W.L. LYONS, LLC (453)"
110757,5344957,BRITTANY,"[BRITTANY  MOLYET, BRITTANY JO TRUSNER]",MOLYET,,,,,10/19/2007 - 3/15/2010,"J.J.B HILLIARD, W.L. LYONS, LLC (453)"
