FIRM_ID,ID,FIRST_NAME,OTHER_NAMES,SECOND_NAME,DISCLOSURE_DATE,DISCLOSURE_TYPE,DISCLOSURE_RESULT,DISCLOSURE_INFO,FINRA_EMPLOYMENT_DATES,FINRA_EMPLOYMENT
19616,5440188,MITCHELL,[MITCHELL EUGENE MARRIOTT],MARRIOTT,11/1/2014,Financial,Final,"{
  ""Type"" : ""Compromise"",
  ""Disposition"" : ""Satisfied/Released"",
  ""Broker Comment"" : ""This agreement did not involve customers or clients in any way. This agreement related to employment compensation only, a \""Hiring Bonus,\"" upon initially accepting the position, that was paid back as agreed in full.""
}",9/19/2019 - Current,"WELLS FARGO CLEARING SERVICES, LLC (19616)"
19616,5440188,MITCHELL,[MITCHELL EUGENE MARRIOTT],MARRIOTT,,,,,1/9/2015 - 8/7/2019,ALPHA WEALTH MANAGEMENT AND PLANNING LLC (163917)
19616,5440188,MITCHELL,[MITCHELL EUGENE MARRIOTT],MARRIOTT,,,,,11/6/2014 - 8/19/2019,LPL FINANCIAL LLC (6413)
19616,5440188,MITCHELL,[MITCHELL EUGENE MARRIOTT],MARRIOTT,,,,,9/13/2013 - 11/17/2014,"UNIONBANC INVESTMENT SERVICES, LLC (14455)"
19616,5440188,MITCHELL,[MITCHELL EUGENE MARRIOTT],MARRIOTT,,,,,6/29/2012 - 8/1/2013,"U.S. BANCORP INVESTMENTS, INC. (17868)"
19616,5440188,MITCHELL,[MITCHELL EUGENE MARRIOTT],MARRIOTT,,,,,7/21/2009 - 4/11/2012,GENWORTH FINANCIAL SECURITIES CORPORATION (10358)
19616,5440188,MITCHELL,[MITCHELL EUGENE MARRIOTT],MARRIOTT,,,,,7/21/2009 - 4/11/2012,GENWORTH FINANCIAL ADVISERS CORPORATION (105644)
19616,5440188,MITCHELL,[MITCHELL EUGENE MARRIOTT],MARRIOTT,,,,,2/13/2008 - 5/13/2009,UBS FINANCIAL SERVICES INC. (8174)
19616,5440188,MITCHELL,[MITCHELL EUGENE MARRIOTT],MARRIOTT,,,,,12/7/2007 - 5/13/2009,UBS FINANCIAL SERVICES INC. (8174)
