FIRM_ID,ID,FIRST_NAME,OTHER_NAMES,SECOND_NAME,DISCLOSURE_DATE,DISCLOSURE_TYPE,DISCLOSURE_RESULT,DISCLOSURE_INFO,FINRA_EMPLOYMENT_DATES,FINRA_EMPLOYMENT
7691,5636621,ENRIQUE,[],MARENTES,4/5/2016,Judgment / Lien,,"{
  ""Judgment/Lien Amount"" : ""$6,151.00"",
  ""Judgment/Lien Type"" : ""Civil""
}",8/18/2015 - 8/1/2016,"MERRILL LYNCH, PIERCE, FENNER & SMITH INCORPORATED (7691)"
7691,5636621,ENRIQUE,[],MARENTES,,,,,12/20/2013 - 7/24/2015,"U.S. BANCORP INVESTMENTS, INC. (17868)"
7691,5636621,ENRIQUE,[],MARENTES,,,,,10/1/2012 - 11/5/2013,J.P. MORGAN SECURITIES LLC (79)
7691,5636621,ENRIQUE,[],MARENTES,,,,,10/16/2009 - 10/1/2012,CHASE INVESTMENT SERVICES CORP. (25574)
7691,5636621,ENRIQUE,[],MARENTES,,,,,4/30/2009 - 8/5/2009,"WELLS FARGO INVESTMENTS, LLC (10582)"
7691,5636621,ENRIQUE,[],MARENTES,,,,,3/18/2009 - 8/5/2009,"WELLS FARGO INVESTMENTS, LLC (10582)"
