FIRM_ID,ID,FIRST_NAME,OTHER_NAMES,SECOND_NAME,DISCLOSURE_DATE,DISCLOSURE_TYPE,DISCLOSURE_RESULT,DISCLOSURE_INFO,FINRA_EMPLOYMENT_DATES,FINRA_EMPLOYMENT
17868,5771965,Algernon,[Al  Tu],Tu,6/1/2020,Employment Separation After Allegations,,"{
  ""Firm Name"" : ""J.P. MORGAN CHASE BANK, NA"",
  ""Termination Type"" : ""Discharged"",
  ""Allegations"" : ""REGISTERED REPRESENTATIVE WAS TERMINATED AFTER ALLEGATIONS WERE MADE THAT TRADES WERE PLACED IN A CUSTOMER'S MANAGED ACCOUNT WITHOUT AUTHORIZATION. THE CUSTOMER CONFIRMED THAT SHE SIGNED THE ACCOUNT OPENING DOCUMENTS WHICH INITIATED THE TRADES.""
}",7/13/2020 - Current,"U.S. BANCORP INVESTMENTS, INC. (17868)"
17868,5771965,Algernon,[Al  Tu],Tu,,,,,10/1/2012 - 6/29/2020,J.P. MORGAN SECURITIES LLC (79)
17868,5771965,Algernon,[Al  Tu],Tu,,,,,4/11/2012 - 10/1/2012,CHASE INVESTMENT SERVICES CORP. (25574)
17868,5771965,Algernon,[Al  Tu],Tu,,,,,4/21/2011 - 10/1/2012,CHASE INVESTMENT SERVICES CORP. (25574)
17868,5771965,Algernon,[Al  Tu],Tu,,,,,4/13/2010 - 6/1/2010,CHASE INVESTMENT SERVICES CORP. (25574)
