FIRM_ID,ID,FIRST_NAME,OTHER_NAMES,SECOND_NAME,DISCLOSURE_DATE,DISCLOSURE_TYPE,DISCLOSURE_RESULT,DISCLOSURE_INFO,FINRA_EMPLOYMENT_DATES,FINRA_EMPLOYMENT
109528,5954916,VINCENT,"[VINCENT AMERICO PANIZZI, VINCENT  PANIZZI]",PANIZZI,10/28/2014,Employment Separation After Allegations,,"{
  ""Firm Name"" : ""MERRILL LYNCH, PIERCE, FENNER & SMITH INCORPORATED"",
  ""Termination Type"" : ""Discharged"",
  ""Allegations"" : ""CONDUCT INCONSISTENT WITH FIRM STANDARDS REGARDING THE USE OF  SOCIAL MEDIA."",
  ""Broker Comment"" : ""TERMINATION AROSE FROM INNOCENT MISUNDERSTANDING REGARDING FIRM POLICY ON SOCIAL MEDIA.  FINANCIAL ADVISOR DISAGREES WITH FIRM DECISION REGARDING TERMINATION.  FINANCIAL ADVISOR STATES THAT NO CLIENTS COMPLAINED OR SUFFERED HARM AS A RESULT OF THE ALLEGED VIOLATION.""
}",6/25/2018 - Current,"MAINSTAY CAPITAL MANAGEMENT, LLC (109528)"
109528,5954916,VINCENT,"[VINCENT AMERICO PANIZZI, VINCENT  PANIZZI]",PANIZZI,,,,,4/4/2016 - 2/20/2018,"SEQUOIA FINANCIAL ADVISORS, L.L.C. (117756)"
109528,5954916,VINCENT,"[VINCENT AMERICO PANIZZI, VINCENT  PANIZZI]",PANIZZI,,,,,10/8/2015 - 5/2/2016,"GHD WEALTH MANAGEMENT, LLC (124541)"
109528,5954916,VINCENT,"[VINCENT AMERICO PANIZZI, VINCENT  PANIZZI]",PANIZZI,,,,,6/12/2012 - 11/11/2014,"MERRILL LYNCH, PIERCE, FENNER & SMITH INCORPORATED (7691)"
109528,5954916,VINCENT,"[VINCENT AMERICO PANIZZI, VINCENT  PANIZZI]",PANIZZI,,,,,4/26/2012 - 11/11/2014,"MERRILL LYNCH, PIERCE, FENNER & SMITH INCORPORATED (7691)"
