FIRM_ID,ID,FIRST_NAME,OTHER_NAMES,SECOND_NAME,DISCLOSURE_DATE,DISCLOSURE_TYPE,DISCLOSURE_RESULT,DISCLOSURE_INFO,FINRA_EMPLOYMENT_DATES,FINRA_EMPLOYMENT
46727,5999732,George,[GEORGE P GELIS],Gelis,2/5/2014,Employment Separation After Allegations,,"{
  ""Firm Name"" : ""JPMORGAN CHASE BANK"",
  ""Termination Type"" : ""Discharged"",
  ""Allegations"" : ""TERMINATED BY AFFILIATE BANK - NON SECURITIES RELATED. TERMINATED BY AFFILIATE BANK. REGISTERED REP, IN THE CAPACITY OF AN AFFILIATE BANK EMPLOYEE, REGISTERED REP VIOLATED THE PERSONAL TRADING POLICY AND CONTINUED TO VIOLATE THE POLICY AFTER BEING WARNED HE WAS IN VIOLATION."",
  ""Broker Comment"" : ""I VIOLATED THE FIRM'S TRADING POLICY AND HAD AN INITIAL MEETING TO STOP TRADING. I CONTINUED AND HAD A SECOND MEETING IN NOVEMBER, WHERE I CEASED ALL TRADING. IN JANUARY WE HAD A MEETING REGARDING THE TRADING AND IN FEBRUARY I WAS TERMINATED.""
}",3/6/2014 - Current,"ADVISORS ASSET MANAGEMENT, INC. (46727)"
46727,5999732,George,[GEORGE P GELIS],Gelis,,,,,2/19/2014 - Current,"ADVISORS ASSET MANAGEMENT, INC. (46727)"
46727,5999732,George,[GEORGE P GELIS],Gelis,,,,,10/22/2012 - 2/28/2014,J.P. MORGAN SECURITIES LLC (79)
46727,5999732,George,[GEORGE P GELIS],Gelis,,,,,11/16/2011 - 5/3/2012,"HORNOR, TOWNSEND & KENT, INC. (4031)"
