FIRM_ID,ID,FIRST_NAME,OTHER_NAMES,SECOND_NAME,DISCLOSURE_DATE,DISCLOSURE_TYPE,DISCLOSURE_RESULT,DISCLOSURE_INFO,FINRA_EMPLOYMENT_DATES,FINRA_EMPLOYMENT
7691,6092867,MATTHEW,[MATTHEW DAVID HILLIARD],HILLIARD,4/8/2015,Employment Separation After Allegations,,"{
  ""Firm Name"" : ""MERRILL LYNCH, PIERCE, FENNER & SMITH INCORPORATED"",
  ""Termination Type"" : ""Discharged"",
  ""Allegations"" : ""ALLEGATIONS RELATED TO CONDUCT INVOLVING EXERCISING DISCRETION IN NONDISCRETIONARY CLIENT ACCOUNTS, RESULTING IN A LOSS OF MANAGEMENT CONFIDENCE."",
  ""Broker Comment"" : ""IN MY OPINION, MERRILL LYNCH, PIERCE, FENNER AND SMITH HAS DECIDED TO TAKE AN EXTREME INTERPRETATION OF A SIMPLE CLERICAL ERROR THAT WAS RECTIFIED IMMEDIATELY UPON DISCOVERY.  IN MY OPINION, I HAVE NEVER ENGAGED IN DISCRETIONARY TRADING AND HAVE NEVER HAD ALLEGATIONS OF THIS TYPE IN THE PAST.  THERE HAVE BEEN NO CLIENT COMPLAINTS FILED AGAINST ME FOR THIS OR ANY OTHER TYPE OF CONDUCT.""
}",7/26/2013 - 5/7/2015,"MERRILL LYNCH, PIERCE, FENNER & SMITH INCORPORATED (7691)"
7691,6092867,MATTHEW,[MATTHEW DAVID HILLIARD],HILLIARD,,,,,7/25/2013 - 5/7/2015,"MERRILL LYNCH, PIERCE, FENNER & SMITH INCORPORATED (7691)"
7691,6092867,MATTHEW,[MATTHEW DAVID HILLIARD],HILLIARD,,,,,9/14/2012 - 1/31/2013,"VALIC FINANCIAL ADVISORS, INC. (42803)"
