FIRM_ID,ID,FIRST_NAME,OTHER_NAMES,SECOND_NAME,DISCLOSURE_DATE,DISCLOSURE_TYPE,DISCLOSURE_RESULT,DISCLOSURE_INFO,FINRA_EMPLOYMENT_DATES,FINRA_EMPLOYMENT
17868,6127874,Christopher,[CHRIS WILLIAM DOLL],Doll,11/4/2014,Employment Separation After Allegations,,"{
  ""Firm Name"" : ""JPMORGAN CHASE BANK"",
  ""Termination Type"" : ""Discharged"",
  ""Allegations"" : ""TERMINATED BY AFFILIATE BANK - NON SECURITIES RELATED. REGISTERED REP, IN THE CAPACITY OF AN AFFILIATE BANK EMPLOYEE, OPENED A BANK ACCOUNT FOR A FRIEND WHO FAXED HIS IDENTIFICATION BUT WAS NOT PRESENT AT THE TIME THE ACCOUNT WAS OPENED IN VIOLATION OF BANK POLICY.""
}",2/20/2020 - Current,"U.S. BANCORP INVESTMENTS, INC. (17868)"
17868,6127874,Christopher,[CHRIS WILLIAM DOLL],Doll,,,,,4/26/2018 - Current,"U.S. BANCORP INVESTMENTS, INC. (17868)"
17868,6127874,Christopher,[CHRIS WILLIAM DOLL],Doll,,,,,4/16/2015 - 12/12/2017,KEY INVESTMENT SERVICES LLC (136300)
17868,6127874,Christopher,[CHRIS WILLIAM DOLL],Doll,,,,,11/25/2013 - 11/24/2014,J.P. MORGAN SECURITIES LLC (79)
