FIRM_ID,ID,FIRST_NAME,OTHER_NAMES,SECOND_NAME,DISCLOSURE_DATE,DISCLOSURE_TYPE,DISCLOSURE_RESULT,DISCLOSURE_INFO,FINRA_EMPLOYMENT_DATES,FINRA_EMPLOYMENT
158292,6315494,TIMOTHY,"[TIM  SCHWISTER, TIMOTHY P. SCHWISTER, TIMOTHY  SCHWISTER]",SCHWISTER,9/28/2014,Judgment / Lien,,"{
  ""Judgment/Lien Amount"" : ""$6,058.54"",
  ""Judgment/Lien Type"" : ""Civil""
}",6/5/2020 - Current,"GLOBAL VIEW CAPITAL MANAGEMENT, LTD (158292)"
158292,6315494,TIMOTHY,"[TIM  SCHWISTER, TIMOTHY P. SCHWISTER, TIMOTHY  SCHWISTER]",SCHWISTER,,,,,8/25/2015 - 3/1/2019,NYLIFE SECURITIES LLC (5167)
