FIRM_ID,ID,FIRST_NAME,OTHER_NAMES,SECOND_NAME,DISCLOSURE_DATE,DISCLOSURE_TYPE,DISCLOSURE_RESULT,DISCLOSURE_INFO,FINRA_EMPLOYMENT_DATES,FINRA_EMPLOYMENT
19616,6395196,CHRISTOPHER,"[CHRIS  BROCKOB, CHRISTOPHER  BROCKOB]",BROCKOB,2/5/2016,Employment Separation After Allegations,,"{
  ""Firm Name"" : ""J.P. MORGAN CHASE BANK"",
  ""Termination Type"" : ""Discharged"",
  ""Allegations"" : ""TERMINATED BY AFFILIATE BANK - NON SECURITIES RELATED. REGISTERED REP, IN THE CAPACITY OF AN AFFILIATE BANK EMPLOYEE, PROVIDED AN UNAPPROVED LETTER TO A BANK CUSTOMER RELATED TO THE BANK CUSTOMER'S ACCOUNT. REGISTERED REP KNEW THE INFORMATION SET FORTH IN THE LETTER WAS INACCURATE. REGISTERED REP WAS INSTRUCTED BY HIS MANAGER NOT TO PROVIDE THE LETTER.""
}",10/24/2017 - Current,"WELLS FARGO CLEARING SERVICES, LLC (19616)"
19616,6395196,CHRISTOPHER,"[CHRIS  BROCKOB, CHRISTOPHER  BROCKOB]",BROCKOB,,,,,7/17/2017 - Current,"WELLS FARGO CLEARING SERVICES, LLC (19616)"
19616,6395196,CHRISTOPHER,"[CHRIS  BROCKOB, CHRISTOPHER  BROCKOB]",BROCKOB,,,,,4/10/2015 - 2/26/2016,J.P. MORGAN SECURITIES LLC (79)
19616,6395196,CHRISTOPHER,"[CHRIS  BROCKOB, CHRISTOPHER  BROCKOB]",BROCKOB,,,,,9/22/2014 - 3/31/2015,"U.S. BANCORP INVESTMENTS, INC. (17868)"
