FIRM_ID,ID,FIRST_NAME,OTHER_NAMES,SECOND_NAME,DISCLOSURE_DATE,DISCLOSURE_TYPE,DISCLOSURE_RESULT,DISCLOSURE_INFO,FINRA_EMPLOYMENT_DATES,FINRA_EMPLOYMENT
1252,813897,GEORGE,[],GLENN,,,,,1/3/1995 - 5/6/1996,WILLIAM BLAIR & COMPANY L.L.C. (1252)
1252,813897,GEORGE,[],GLENN,,,,,3/21/1988 - 1/10/1989,DREXEL BURNHAM LAMBERT INCORPORATED (7323)
1252,813897,GEORGE,[],GLENN,,,,,6/26/1984 - 2/20/1988,SHEARSON LEHMAN HUTTON INC. (7506)
1252,813897,GEORGE,[],GLENN,,,,,9/15/1978 - 6/27/1984,LEHMAN BROTHERS KUHN LOEB INCORPORATED (7555)
1252,813897,GEORGE,[],GLENN,,,,,7/22/1976 - 8/25/1978,"MERRILL LYNCH, PIERCE, FENNER & SMITH, INC. (572)"
1252,813897,GEORGE,[],GLENN,,,,,10/22/1975 - 3/2/1976,PHOENIX EQUITY PLANNING CORPORATION (3036)
