FIRM_ID,ID,FIRST_NAME,OTHER_NAMES,SECOND_NAME,DISCLOSURE_DATE,DISCLOSURE_TYPE,DISCLOSURE_RESULT,DISCLOSURE_INFO,FINRA_EMPLOYMENT_DATES,FINRA_EMPLOYMENT
46173,834421,ZACH,[ZACH E THOMAS],THOMAS,2/2/2010,Judgment / Lien,,"{
  ""Judgment/Lien Amount"" : ""$40,597.79"",
  ""Judgment/Lien Type"" : ""Tax"",
  ""Broker Comment"" : ""INSTALLMENT PAYMENTS, ARRANGEMENT WITH THE IRS UNTIL TAX LIEN IS PAID.""
}",5/3/1999 - Current,PARK AVENUE SECURITIES LLC (46173)
46173,834421,ZACH,[ZACH E THOMAS],THOMAS,,,,,10/20/1994 - 5/3/1999,GUARDIAN INVESTOR SERVICES CORPORATION (6635)
46173,834421,ZACH,[ZACH E THOMAS],THOMAS,,,,,10/19/1987 - 10/6/1994,"NORTHWESTERN MUTUAL INVESTMENT SERVICES, INC. (2881)"
46173,834421,ZACH,[ZACH E THOMAS],THOMAS,,,,,10/19/1987 - 10/6/1994,ROBERT W. BAIRD & CO. INCORPORATED (8158)
46173,834421,ZACH,[ZACH E THOMAS],THOMAS,,,,,2/4/1977 - 10/13/1987,JOHN HANCOCK MUTUAL LIFE INSURANCE COMPANY (5181)
46173,834421,ZACH,[ZACH E THOMAS],THOMAS,,,,,2/4/1977 - 8/22/1987,"JOHN HANCOCK DISTRIBUTORS, INC. (468)"
