FIRM_ID,ID,FIRST_NAME,OTHER_NAMES,SECOND_NAME,DISCLOSURE_DATE,DISCLOSURE_TYPE,DISCLOSURE_RESULT,DISCLOSURE_INFO,FINRA_EMPLOYMENT_DATES,FINRA_EMPLOYMENT
46173,858257,WILLIAM,[WILLIAM J ANGARANO],ANGARANO,5/27/2011,Financial,Pending,"{
  ""Type"" : ""Bankruptcy"",
  ""Disposition"" : ""SIPA Trustee Appointed"",
  ""Broker Comment"" : ""MY BANKRUPTCY PLAN HAS BEEN ACCEPTED AND CONFIRMED BY THE COURT SO LONG AS I CONTINUE TO MAKE MY MONTHLY PAYMENTS AND COMPLY WITH THE OTHER PLAN PROVISIONS, MY BANKRUPTCY WILL BE FULLY SATISFIED BY MAY 23,2016""
}",9/18/2013 - 12/12/2014,PARK AVENUE SECURITIES LLC (46173)
46173,858257,WILLIAM,[WILLIAM J ANGARANO],ANGARANO,,,,,6/14/2001 - 9/18/2013,PARK AVENUE SECURITIES LLC (46173)
46173,858257,WILLIAM,[WILLIAM J ANGARANO],ANGARANO,,,,,5/3/1999 - 9/18/2013,PARK AVENUE SECURITIES LLC (46173)
46173,858257,WILLIAM,[WILLIAM J ANGARANO],ANGARANO,,,,,3/13/1984 - 5/3/1999,GUARDIAN INVESTOR SERVICES CORPORATION (6635)
46173,858257,WILLIAM,[WILLIAM J ANGARANO],ANGARANO,,,,,11/25/1981 - 2/21/1984,"NATHAN, LEWIS & GRANT, INC. (8503)"
46173,858257,WILLIAM,[WILLIAM J ANGARANO],ANGARANO,,,,,10/23/1978 - 3/15/1984,"CONNECTICUT MUTUAL FINANCIAL SERVICES, INC. (173)"
